{
  "$comment": "GENERATED by contracts/codegen/generate.py from task.schema.yaml - DO NOT EDIT.",
  "$schema": "https://json-schema.org/draft/2020-12/schema",
  "additionalProperties": true,
  "description": "A versioned task-menu entry (prompt resolved as-of recording) \u2014 CONTRACT \u00a73.1/\u00a73.5.",
  "properties": {
    "bimanual": {
      "description": "Whether the task is bimanual.",
      "type": "boolean"
    },
    "category": {
      "description": "Task category (open string; structured attribute).",
      "type": [
        "string",
        "null"
      ]
    },
    "effective_from": {
      "description": "Start of this version's validity (OQ-6).",
      "type": [
        "string",
        "null"
      ]
    },
    "effective_to": {
      "description": "End of validity; null = current (OQ-6).",
      "type": [
        "string",
        "null"
      ]
    },
    "expected_duration_s": {
      "description": "Expected duration in seconds.",
      "type": [
        "number",
        "null"
      ]
    },
    "prompt": {
      "description": "Task prompt (versioned; resolved as-of recording).",
      "type": "string"
    },
    "rotation_id": {
      "description": "Rotation identity.",
      "type": "string"
    },
    "schema": {
      "description": "Schema identifier; additive semver (\u00a75).",
      "enum": [
        "eunomia-task/v1"
      ],
      "type": "string"
    },
    "station_id": {
      "description": "LEGACY \u2014 the old hardcoded station\u2194task coupling. SUPERSEDED by eunomia-task-station-assignment (the authoritative link). Kept additive (\u00a75); non-authoritative.",
      "type": "string"
    },
    "task_id": {
      "description": "The task identity (the anchor).",
      "minLength": 1,
      "type": "string"
    },
    "task_name": {
      "description": "Human task name.",
      "type": "string"
    },
    "version": {
      "description": "Task version axis (a prompt change is a new version; resolved as-of recorded_at, OQ-6).",
      "type": "integer"
    }
  },
  "required": [
    "schema",
    "task_id"
  ],
  "title": "Task",
  "type": "object"
}
